{
  "id": "customer.bioivt.therapy_route_list",
  "title": "BioIVT: oncology therapy administration uses the shared route list",
  "kind": "structured",
  "scope": "customer",
  "scope_id": "bioIVT",
  "status": "active",
  "natural_key": "bioivt_therapy_route_list",
  "description": "Turns the free-text Therapy Administration question on the Oncology form into a pick list using the shared canon_cm_route list (CDISC CMROUTE plus Intravenous and Other).",
  "rationale": "Free text becomes a pick list per the approved choice-list rules.",
  "target": "field",
  "applies_when": {
    "form.form_id": "ONCOLOGY",
    "field.name": "THERADMIN"
  },
  "effect": {
    "use_canonical_list": "cm_route"
  },
  "created_at": "2026-10-05T00:00:00Z",
  "created_by": "human:dswanker",
  "source": "BIOIVT_BEFORE_AFTER.html Phase 1 plan, approved by Dan",
  "tags": [
    "bioivt",
    "phase_1",
    "choice_list"
  ],
  "history": [
    {
      "at": "2026-10-05T00:00:00Z",
      "by": "human:dswanker",
      "action": "created",
      "status": "active",
      "note": "Phase 1 build. Approved by Dan after reviewing the before/after page."
    }
  ]
}
