{
  "id": "test.archived_should_be_skipped",
  "title": "An archived rule",
  "kind": "structured",
  "scope": "global",
  "status": "archived",
  "natural_key": "archived_test",
  "description": "This convention is archived and the loader should drop it.",
  "target": "form",
  "applies_when": { "form.form_id": "ZZ" },
  "effect": { "set": { "form.form_id": "ZZ_ARCHIVED" } },
  "created_at": "2026-05-13T14:00:00Z",
  "created_by": "system:test_fixture",
  "source": "test:fixtures"
}
