{
  "id": "customer.bioivt.vocab_icdo3_topography",
  "title": "BioIVT: tumour location questions become a type-ahead ICD-O-3 tumour site lookup",
  "kind": "structured",
  "scope": "customer",
  "scope_id": "bioIVT",
  "status": "active",
  "natural_key": "bioivt_vocab_icdo3_topography",
  "description": "Turns the free-text Tumor Location question on Oncology and Confirmed Tumor Location on the BioIVT oncology form into a type-ahead lookup over the ICD-O-3 site groups published by SEER (82 groups, such as Lung and bronchus, Breast, Colon). The stored value is the SEER site recode range. DEMONSTRATION list: real codes, partial, not clinically reviewed; licences to be confirmed before real use.",
  "rationale": "Dan's decision: ICD-O-3 for tumour location. Real answers are organ level, which matches the SEER site groups; individual subsite codes (such as C34.1) are not in this list.",
  "target": "field",
  "applies_when": {
    "any_of": [
      {
        "form.form_id": "ONCOLOGY",
        "field.name": "TUMLOCA"
      },
      {
        "form.form_id": "BIOIVTONC",
        "field.name": "TUM_LOC_CONF"
      }
    ]
  },
  "effect": {
    "use_vocabulary": {
      "file": "icdo3_topography_demo.csv"
    }
  },
  "created_at": "2026-10-06T00:00:00Z",
  "created_by": "human:dswanker",
  "source": "BioIVT Option C build for the client demonstration; approved by Dan",
  "tags": [
    "bioivt",
    "phase_2",
    "vocabulary",
    "icdo3",
    "tumour_site"
  ],
  "history": [
    {
      "at": "2026-10-06T00:00:00Z",
      "by": "human:dswanker",
      "action": "created",
      "status": "active",
      "note": "Phase 2 build for the client demonstration."
    }
  ]
}
